{"actions":[{"description":"Declare the baseline strategy before any execution.","effects":[{"set":{"value":true,"var":"baselineDeclared"}}],"guard":{"all":[{"not":{"var":"baselineDeclared"}},{"not":{"var":"baselineExecuted"}},{"not":{"var":"resultPublished"}}]},"id":"declareBaseline","max_occurrences":1,"sensor_cost":{"operational":0,"privacy":0,"trust":0},"tags":["declaration"]},{"description":"Execute the selected baseline strategy.","effects":[{"set":{"value":true,"var":"baselineExecuted"}}],"guard":{"all":[{"not":{"var":"baselineExecuted"}},{"not":{"var":"resultPublished"}}]},"id":"executeBaseline","max_occurrences":1,"sensor_cost":{"operational":0,"privacy":0,"trust":0},"tags":["execution"]},{"description":"Execute an unreported parameter sweep before publishing the baseline.","effects":[{"set":{"value":true,"var":"hiddenSweepExecuted"}}],"guard":{"all":[{"var":"baselineExecuted"},{"not":{"var":"hiddenSweepExecuted"}},{"not":{"var":"resultPublished"}}]},"id":"executeHiddenSweep","max_occurrences":1,"sensor_cost":{"operational":0,"privacy":0,"trust":0},"tags":["execution","adversarial_execution"]},{"description":"Read a future data revision unavailable at the decision time.","effects":[{"set":{"value":true,"var":"futureDataRead"}}],"guard":{"all":[{"var":"baselineExecuted"},{"not":{"var":"futureDataRead"}},{"not":{"var":"resultPublished"}}]},"id":"readFutureData","max_occurrences":1,"sensor_cost":{"operational":0,"privacy":0,"trust":0},"tags":["data_access","adversarial_execution"]},{"description":"Publish the selected result bundle.","effects":[{"set":{"value":true,"var":"resultPublished"}}],"guard":{"all":[{"var":"baselineExecuted"},{"not":{"var":"resultPublished"}}]},"id":"publishResult","max_occurrences":1,"sensor_cost":{"operational":0,"privacy":0,"trust":0},"tags":["publication"]},{"description":"Externally timestamp the researcher-visible ledger prefix.","effects":[{"set":{"value":true,"var":"ledgerAnchored"}}],"guard":{"all":[{"var":"resultPublished"},{"not":{"var":"ledgerAnchored"}}]},"id":"anchorLedger","max_occurrences":1,"sensor_cost":{"operational":0,"privacy":0,"trust":0},"tags":["anchoring"]},{"description":"Alter the cost model after execution while leaving the researcher-visible declaration unchanged.","effects":[{"set":{"value":true,"var":"costModelTampered"}}],"guard":{"all":[{"var":"baselineExecuted"},{"not":{"var":"resultPublished"}}]},"id":"tamperCostModel","max_occurrences":1,"sensor_cost":{"operational":0,"privacy":0,"trust":0},"tags":["adversarial_execution","configuration_mutation"]}],"channels":[{"cost":{"operational":2,"privacy":0,"trust":0},"deployed":true,"description":"The researcher-visible declaration, publication, and anchoring history.","id":"selfReport","visible_actions":["declareBaseline","publishResult","anchorLedger"],"visible_state":["baselineDeclared","resultPublished","ledgerAnchored"]},{"cost":{"operational":1,"privacy":0,"trust":0},"deployed":true,"description":"Canonical artifacts for the selected result.","id":"resultBundle","visible_actions":["publishResult"],"visible_state":["resultPublished"]},{"cost":{"operational":1,"privacy":0,"trust":2},"deployed":true,"description":"A valid RFC 3161 timestamp over the researcher-visible ledger.","id":"rfc3161Anchor","visible_actions":["anchorLedger"],"visible_state":["ledgerAnchored"]},{"cost":{"operational":4,"privacy":2,"trust":0},"deployed":false,"description":"An independent log revealing every execution and sensitive data-access event.","id":"fullExecutorLog","visible_actions":["executeBaseline","executeHiddenSweep","readFutureData"],"visible_state":[]}],"claim":{"all":[{"any":[{"not":{"var":"baselineExecuted"}},{"var":"baselineDeclared"}]},{"not":{"var":"hiddenSweepExecuted"}},{"not":{"var":"futureDataRead"}},{"not":{"var":"costModelTampered"}}]},"cost_weights":{"operational":1,"privacy":1,"trust":1},"max_depth":7,"max_histories":256,"max_refinements":4,"name":"observed-cost-model-tampering-refinement","namespace_prefix":"LeanFinance.Generated.ObservedCostModelTampering","schema_version":"lfv-workflow-cegis-model-v1","sensor_templates":[{"action_tags":["adversarial_execution"],"cost":{"operational":2,"privacy":0,"trust":0},"description":"A narrow independent receipt for one specifically instrumented adversarial action.","id":"targetedReceipt","kind":"action","variables":[]}],"terminal":{"var":"ledgerAnchored"},"trace_aliases":[{"description":"The baseline is executed without a prior declaration.","id":"undeclaredBaseline","trace":["executeBaseline","publishResult","anchorLedger"]},{"description":"The declared baseline is the only execution and uses only admissible data.","id":"honest","trace":["declareBaseline","executeBaseline","publishResult","anchorLedger"]},{"description":"An unreported parameter sweep is executed before publishing the same visible result.","id":"hiddenSweep","trace":["declareBaseline","executeBaseline","executeHiddenSweep","publishResult","anchorLedger"]},{"description":"The baseline reads a future data revision before publishing the same visible result.","id":"futureLeak","trace":["declareBaseline","executeBaseline","readFutureData","publishResult","anchorLedger"]},{"description":"A hidden sweep and a future-data access both occur before publication.","id":"dualAttack","trace":["declareBaseline","executeBaseline","executeHiddenSweep","readFutureData","publishResult","anchorLedger"]},{"description":"The declared baseline is executed, its cost model is altered outside the visible ledger, and the same result is then published and timestamped.","id":"costModelTampering","trace":["declareBaseline","executeBaseline","tamperCostModel","publishResult","anchorLedger"]}],"variables":[{"description":"Whether the baseline strategy was declared before execution.","id":"baselineDeclared","initial":false,"sensor_cost":{"operational":1,"privacy":0,"trust":1}},{"description":"Whether the baseline strategy was executed.","id":"baselineExecuted","initial":false,"sensor_cost":{"operational":1,"privacy":1,"trust":1}},{"description":"Whether an unreported parameter sweep was executed.","id":"hiddenSweepExecuted","initial":false,"sensor_cost":{"operational":1,"privacy":1,"trust":1}},{"description":"Whether data unavailable at the decision time was read.","id":"futureDataRead","initial":false,"sensor_cost":{"operational":1,"privacy":1,"trust":1}},{"description":"Whether the selected result was published.","id":"resultPublished","initial":false,"sensor_cost":{"operational":1,"privacy":0,"trust":1}},{"description":"Whether the researcher-visible ledger received an external anchor.","id":"ledgerAnchored","initial":false,"sensor_cost":{"operational":1,"privacy":0,"trust":1}},{"description":"Whether the registered transaction-cost model was altered after the baseline execution contract was fixed.","id":"costModelTampered","initial":false,"sensor_cost":{"operational":1,"privacy":1,"trust":1}}]}